{
 "id": "i009",
 "titulo": "Conciliación bancaria y precontabilización aprendida para estudios contables",
 "problema": "Los estudios contables de Montevideo contratan asistentes para registrar asientos y conciliar bancos, con Excel intermedio (F-legal-contable-005); dos avisos más lo repiten (F-defensa-r2-m03-i009-001, F-defensa-r2-m03-i009-002), sin horas ni costo medidos (supuesto). Una SRL pequeña paga honorarios fijos de $U 18.000 a 25.000 por mes (F-legal-contable-001), así que más carga resta margen (inferencia declarada). Los CFE ya son casi universales (F-legal-contable-002). Herramientas uruguayas ya convierten CFE en asientos (F-ataque-r1-m05-i009-cliente-001, F-ataque-r1-m05-i009-cliente-002) con planes pagos (F-ataque-r1-m05-i009-cliente-003): esa carga está cubierta. Sus páginas no mencionan conciliación ni imputación aprendida (F-defensa-r1-m05-i009-001, F-defensa-r1-m05-i009-002): es silencio, no prueba; se verifica.",
 "usuario": "Asistentes y contadores de estudios contables de 2 a 20 personas que llevan la contabilidad de pymes. Paga el estudio.",
 "solucion": "Complemento de las herramientas de CFE a asiento: concilia los movimientos del banco. El estudio sube extractos (CSV o PDF de 2 bancos) y los XML de CFE que ya maneja. El sistema los cruza con comprobantes, propone la cuenta aprendiendo de las imputaciones previas de cada cliente (reglas y embeddings locales) y deja una cola de excepciones para revisión humana. Exporta CSV o planilla configurable. Todo es local, sin LLM externo ni transferencia internacional de datos (art. 23 Ley 18.331, F-ataque-r1-m05-i009-cliente-004), con acuerdo escrito y base registrada en el piloto.",
 "mvp": {
  "semestre_1": [
   "Ingesta de XML de CFE y extractos de 2 bancos, con extracción local",
   "Propuesta de imputación y cola de revisión, contra una línea de base de reglas",
   "Demo con datos sintéticos, midiendo acierto"
  ],
  "semestre_2": [
   "Conciliación bancaria con métricas de acierto y horas",
   "Exportación configurable y vista multi-cliente",
   "Piloto voluntario con acuerdo de datos en 1 o 2 estudios"
  ]
 },
 "stack": [
  "Python FastAPI",
  "React",
  "PostgreSQL con pgvector",
  "lxml para XML de CFE",
  "Extracción local de PDF",
  "Embeddings locales en CPU (modelo multilingüe pequeño)",
  "Docker",
  "AWS Lightsail"
 ],
 "costo_infra": {
  "total_anual_usd": 164,
  "items": [
   {
    "concepto": "Servidor AWS Lightsail 2 GB",
    "usd_anual": 144,
    "supuesto": "1 instancia de USD 12 por mes, 12 meses, sin capa gratuita. Se asume que embeddings pequeños corren en CPU ahí.",
    "fuente_precio_url": "https://aws.amazon.com/lightsail/pricing/"
   },
   {
    "concepto": "Dominio y DNS",
    "usd_anual": 20,
    "supuesto": "Estimación por encima, sin página de precios abierta: un dominio .com más DNS, redondeado a USD 20."
   }
  ]
 },
 "competidores": [
  {
   "nombre": "Contafácil",
   "evidencia_ids": [
    "F-ataque-r1-m05-i009-cliente-001",
    "F-ataque-r1-m05-i009-cliente-003",
    "F-defensa-r1-m05-i009-002"
   ],
   "hueco": "Descarga CFE y entrega asientos, empresas ilimitadas. No menciona conciliación bancaria, PDF ni sugerencia de cuenta; podría agregarla."
  },
  {
   "nombre": "Contable.CFE",
   "evidencia_ids": [
    "F-ataque-r1-m05-i009-cliente-002",
    "F-defensa-r1-m05-i009-001"
   ],
   "hueco": "Convierte CFE en asientos con cuentas configuradas una vez; no menciona conciliación ni aprendizaje."
  },
  {
   "nombre": "YoFacturo y otros proveedores de CFE",
   "evidencia_ids": [
    "F-legal-contable-003"
   ],
   "hueco": "Describen emisión y puntos de venta, no procesamiento para estudios."
  }
 ],
 "monetizacion": "Plan plano por estudio, complemento de la herramienta de CFE que use. Referencia a validar: $U 1.500 a 3.500 por mes según tramo, bajo el plan más alto de Contafácil ($3.799 por mes, moneda no rotulada, F-ataque-r1-m05-i009-cliente-003). Canal: venta directa.",
 "riesgos": [
  "Sin estudio voluntario, el acierto solo se mide sobre datos sintéticos, que no prueban acierto real",
  "Formatos de extracto distintos por banco",
  "Un competidor con descarga de DGI podría agregar conciliación rápido: la ventaja es de tiempo",
  "El estudio mantiene dos herramientas y sube XML a mano"
 ],
 "supuestos": [
  "Los estudios reciben los XML de CFE o pueden obtenerlos",
  "Un estudio típico atiende decenas de empresas; no hay cifra de estudios de 2 a 20 personas",
  "La carga contable resta margen (inferencia de honorarios fijos)",
  "Los estudios concilian a mano o con Excel y pagarían por evitarlo: sin ficha de pago",
  "Precio de $U 1.500 a 3.500 por mes aceptable, sin ficha",
  "Los bancos permiten exportar extractos en CSV o PDF",
  "Meta: 80 por ciento de acierto de imputación en proveedores recurrentes, con horas medidas en el piloto",
  "Antes de diciembre de 2026: probar el plan gratuito de Contafácil (F-ataque-r1-m05-i009-cliente-003) y entrevistar estudios; hoy no hay contactos cargados"
 ],
 "evidencias": [
  "F-legal-contable-005",
  "F-legal-contable-001",
  "F-legal-contable-002",
  "F-legal-contable-003",
  "F-ataque-r1-m05-i009-cliente-001",
  "F-ataque-r1-m05-i009-cliente-002",
  "F-ataque-r1-m05-i009-cliente-003",
  "F-ataque-r1-m05-i009-cliente-004",
  "F-defensa-r1-m05-i009-001",
  "F-defensa-r1-m05-i009-002",
  "F-defensa-r2-m03-i009-001",
  "F-defensa-r2-m03-i009-002"
 ]
}