{
 "id": "i002",
 "titulo": "Seguimiento de pacientes tras un intento de autoeliminación para equipos de salud mental",
 "problema": "En 2025 el MSP registró 668 suicidios y 6.140 intentos de 5.144 personas: casi mil intentos fueron de personas que ya habían intentado ese mismo año (F-salud-009). El MSP propone una llamada dentro de los 2 días del egreso y una consulta dentro de los 7 (F-defensa-r1-m08-i002-001) y desde 2022 obliga a registrar cada intento en 24 horas, sin fijar cómo se hace el seguimiento (F-defensa-r1-m08-i002-002). Cuántos pacientes no vuelven es un supuesto a validar.",
 "usuario": "Equipos de salud mental de prestadores chicos, policlínicas del interior y organizaciones que hoy, suponemos, siguen casos con planillas. Paga la institución; lo usan psicólogos, psiquiatras y referentes de seguimiento.",
 "solucion": "Una herramienta de gestión de casos: al ingresar un paciente tras un intento se crea un plan de contactos con fechas (llamada a los 2 días, consulta a los 7, luego 30 y 90), el sistema asigna responsable y avisa al equipo cuando un contacto vence sin registrarse, para que lo resuelva por teléfono. Permite exportar un resumen del caso. No calcula riesgo, no diagnostica y no envía mensajes al paciente: organiza el seguimiento que el equipo ya decide.",
 "mvp": {
  "semestre_1": [
   "Registro de casos con consentimiento, roles y bitácora de auditoría",
   "Planes de contacto configurables con vencimientos y tablero del equipo",
   "Demo al tutor con casos ficticios"
  ],
  "semestre_2": [
   "Alertas de contactos vencidos al equipo (pantalla y correo)",
   "Resumen exportable y cifrado de datos sensibles",
   "Prueba de uso con casos ficticios ante un equipo de salud mental y entrevistas de validación, sin datos reales de pacientes",
   "Business case y plan de cumplimiento de la Ley 18.331, con registro de la base ante la URCDP"
  ]
 },
 "stack": [
  "Python FastAPI",
  "PostgreSQL con cifrado de columnas",
  "React",
  "Docker",
  "AWS Lightsail"
 ],
 "costo_infra": {
  "total_anual_usd": 119,
  "items": [
   {
    "concepto": "Servidor AWS Lightsail Linux 1 GB con IPv4",
    "usd_anual": 84,
    "supuesto": "Un servidor 12 meses a USD 7 por mes; sin contar capa gratuita porque la página no dice cuánto dura.",
    "fuente_precio_url": "https://aws.amazon.com/lightsail/pricing/"
   },
   {
    "concepto": "Respaldos (snapshots) del servidor",
    "usd_anual": 20,
    "supuesto": "Estimación por encima sin fuente abierta: un snapshot diario rotado de unos 40 GB, redondeado hacia arriba."
   },
   {
    "concepto": "Dominio propio",
    "usd_anual": 15,
    "supuesto": "Estimación por encima sin fuente abierta: un dominio .com por un año, redondeado hacia arriba con margen."
   }
  ]
 },
 "competidores": [
  {
   "nombre": "Zalon",
   "evidencia_ids": [
    "F-salud-006"
   ],
   "hueco": "Agenda y recordatorios para profesionales de salud y estética; no maneja planes de seguimiento con vencimientos y alerta al equipo. Podría agregarlo."
  },
  {
   "nombre": "AgendaPro",
   "evidencia_ids": [
    "F-salud-007"
   ],
   "hueco": "Software argentino de centros médicos con turnos y recordatorios; la ficha no muestra seguimiento de casos ni presencia en Uruguay."
  }
 ],
 "monetizacion": "Suscripción mensual por equipo institucional, de USD 100 a 200 según casos activos. Canal: venta directa a direcciones técnicas de prestadores chicos y organizaciones de salud mental. Precio y disposición a pagar se validan en entrevistas.",
 "riesgos": [
  "Datos de salud mental muy sensibles: en 2027 solo hay casos ficticios y el cumplimiento se diseña antes de cualquier dato real",
  "Sin socio identificado: la validación depende de entrevistas, no de un piloto con pacientes",
  "Agendas médicas con recordatorios podrían copiar el módulo",
  "Herramienta aparte de la historia clínica: puede implicar doble carga de datos",
  "Presupuestos acotados de los prestadores chicos"
 ],
 "supuestos": [
  "Las fichas no muestran herramientas de seguimiento post intento; no afirmo que no existan",
  "Los equipos de prestadores chicos siguen hoy estos casos con planillas o papel",
  "Hay pacientes que no vuelven al control, y los equipos quieren detectarlo",
  "Una institución paga USD 100 a 200 al mes por esta herramienta",
  "Una herramienta que no diagnostica ni puntúa riesgo no requiere habilitación como dispositivo médico",
  "WhatsApp Business restringe mensajes de salud (F-ataque-r1-m08-i002-cliente-001): el MVP no los usa",
  "Registrar la base ante la URCDP es un trámite posible para el equipo"
 ],
 "evidencias": [
  "F-salud-009",
  "F-defensa-r1-m08-i002-001",
  "F-defensa-r1-m08-i002-002",
  "F-salud-006",
  "F-salud-007",
  "F-ataque-r1-m08-i002-cliente-001"
 ]
}
