{
 "id": "i009",
 "titulo": "Precontabilización automática de comprobantes y extractos para estudios contables",
 "problema": "Los estudios contables de Montevideo contratan asistentes para registrar asientos, conciliar bancos y cuentas de clientes y proveedores, con Excel intermedio (F-legal-contable-005). El estudio cobra honorarios fijos de $U 18.000 a 25.000 por mes por SRL pequeña (F-legal-contable-001): cada hora de carga se come margen. Los comprobantes ya son electrónicos para casi todos los contribuyentes (F-legal-contable-002), pero los dolores siguen: doble carga cuando el sistema no integra y dificultad para exportar XML (F-legal-contable-003). Un ERP con localización como Odoo exige configuración técnica no trivial (F-legal-contable-004).",
 "usuario": "Asistentes y contadores de estudios contables de 2 a 20 personas que llevan la contabilidad de pymes. Paga el estudio.",
 "solucion": "Captura y precontabilización multi-cliente, al estilo de herramientas británicas para estudios, adaptada a Uruguay. El estudio sube o reenvía por correo los XML de CFE recibidos y emitidos, PDFs y extractos bancarios de sus clientes. El sistema extrae RUT, tipo de CFE, montos e IVA; propone la cuenta contable aprendiendo de las imputaciones anteriores de cada cliente (embeddings y reglas); concilia movimientos bancarios contra comprobantes y deja una cola de excepciones para revisión humana. Exporta asientos en planilla o CSV para importar al sistema contable del estudio. Lo que cambia: el formato CFE uruguayo, plan de cuentas local, bancos locales y precio por empresa cliente.",
 "mvp": {
  "semestre_1": [
   "Ingesta de XML de CFE y extractos en CSV o PDF de 2 bancos",
   "Propuesta de imputación con reglas y similitud, y cola de revisión",
   "Demo con datos anonimizados de 3 empresas cliente"
  ],
  "semestre_2": [
   "Conciliación bancaria automática con métricas de acierto",
   "Exportación de asientos en planilla configurable y vista multi-cliente para el estudio",
   "Piloto con 1 o 2 estudios midiendo horas ahorradas"
  ]
 },
 "stack": [
  "Python FastAPI",
  "React",
  "PostgreSQL con pgvector",
  "lxml para XML de CFE",
  "Claude Haiku 5.5 vía API para PDFs",
  "Docker",
  "AWS Lightsail"
 ],
 "costo_infra": {
  "total_anual_usd": 184,
  "items": [
   {
    "concepto": "Servidor AWS Lightsail 2 GB",
    "usd_anual": 144,
    "supuesto": "1 instancia de USD 12 por mes, 12 meses, sin capa gratuita.",
    "fuente_precio_url": "https://aws.amazon.com/lightsail/pricing/"
   },
   {
    "concepto": "API de LLM Claude Haiku 5.5",
    "usd_anual": 20,
    "supuesto": "40.000 PDFs de prueba a 1.500 tokens de entrada y 300 de salida: USD 6 más USD 6, redondeado a 20. Los XML se leen sin LLM.",
    "fuente_precio_url": "https://claude.com/pricing"
   },
   {
    "concepto": "Dominio y DNS",
    "usd_anual": 20,
    "supuesto": "Estimación por encima, sin página de precios abierta: un dominio .com más DNS, redondeado a USD 20."
   }
  ]
 },
 "competidores": [
  {
   "nombre": "YoFacturo y otros proveedores de CFE",
   "evidencia_ids": [
    "F-legal-contable-003",
    "F-comercio-retail-008"
   ],
   "hueco": "Están pensados para que cada empresa emita y gestione sus comprobantes, no para que un estudio procese y concilie los de muchos clientes."
  },
  {
   "nombre": "Odoo con localización Uruguay",
   "evidencia_ids": [
    "F-legal-contable-004"
   ],
   "hueco": "Es un ERP completo por empresa con configuración técnica no trivial; no sirve como capa liviana sobre el sistema que ya usa el estudio."
  }
 ],
 "monetizacion": "Suscripción del estudio por empresa cliente activa, con un precio de referencia de USD 3 a 5 por empresa por mes; un estudio con 40 clientes pagaría USD 120 a 200 por mes. Canal: venta directa a estudios.",
 "riesgos": [
  "Acceso a XML y extractos reales depende de que los estudios los compartan bajo Ley 18.331",
  "Formatos de extracto distintos por banco",
  "Si el acierto de imputación es bajo, la revisión anula el ahorro",
  "Integración con cada sistema contable del estudio"
 ],
 "supuestos": [
  "Los estudios reciben de sus clientes los XML de CFE o pueden obtenerlos",
  "Existen en el Reino Unido herramientas de captura de comprobantes para estudios contables, sin ficha que lo respalde",
  "Un estudio típico atiende decenas de empresas cliente",
  "Precio de USD 3 a 5 por empresa por mes aceptable",
  "Los bancos uruguayos permiten exportar extractos en CSV o PDF"
 ],
 "evidencias": [
  "F-legal-contable-005",
  "F-legal-contable-001",
  "F-legal-contable-002",
  "F-legal-contable-003",
  "F-legal-contable-004",
  "F-comercio-retail-008"
 ]
}
