{
 "id": "i002",
 "titulo": "Libreta ganadera por voz y sin señal para productores chicos, con datos listos para el SNIG",
 "problema": "Todo productor ganadero debe notificar al SNIG movimientos, cambios de propiedad y eventos productivos y sanitarios de cada bovino, con más de 12 millones identificados (F-agro-002); el MGAP además digitaliza las guías de tránsito (F-agro-004). La ficha prueba la obligación, no su costo: cuánto tiempo y errores le cuesta al productor chico es un supuesto a medir. Entre las opciones de las fichas, miTambo es barata y sin internet pero solo para tambos (F-agro-001), Cattler apunta a feedlots (F-agro-006) y Albor es un sistema integral de otra escala (F-agro-007).",
 "usuario": "Productor ganadero pastoril chico de Uruguay y su personal de campo. Paga el productor; segundo canal: veterinarios con varios clientes.",
 "solucion": "PWA que funciona sin señal. El peón dicta un audio (vacunamos 38 terneros del potrero 4) o usa un formulario corto. Al reconectar, el audio se transcribe y un LLM propone eventos (nacimiento, vacunación, muerte, movimiento, venta) que el mismo peón confirma en el teléfono con un toque; las caravanas y lotes se resuelven contra el inventario local y, si la IA duda, deja el campo vacío en vez de adivinar. Los eventos son un registro de solo agregar, así el stock por lote se recalcula sin conflictos de edición. Genera la lista de pendientes del SNIG y la exporta lista para copiar o descargar y cargar en el canal oficial; no declara por el productor.",
 "mvp": {
  "semestre_1": [
   "PWA offline con inventario por lote, registro de eventos de solo agregar y sincronización",
   "FastAPI y PostgreSQL en Lightsail; audio grabado sin señal y transcripto al reconectar",
   "Demo: 20 eventos cargados en modo avión actualizan el rodeo al reconectar",
   "Entrevistas a productores y veterinarios para medir el costo actual de registrar y notificar, y probar el precio"
  ],
  "semestre_2": [
   "Extracción de eventos con LLM, resolución de caravanas y confirmación del peón",
   "Precisión medida sobre 300 audios por tipo de evento: guiones con jerga rural grabados por el equipo y los audios que aporte el piloto",
   "Pendientes SNIG con exportación, y vista multi-cliente para veterinarios",
   "Piloto de 8 semanas con 3 a 5 establecimientos, comparando minutos por evento contra su método actual"
  ]
 },
 "stack": [
  "React + Vite (PWA)",
  "IndexedDB (Dexie)",
  "Python FastAPI",
  "PostgreSQL",
  "OpenAI gpt-4o-mini-transcribe",
  "Claude Haiku 4.5",
  "Docker Compose",
  "AWS Lightsail"
 ],
 "costo_infra": {
  "total_anual_usd": 164,
  "items": [
   {
    "concepto": "AWS Lightsail Linux 1 GB, IPv4",
    "usd_anual": 84,
    "supuesto": "USD 7 por mes x 12; API y PostgreSQL en Docker para hasta 30 establecimientos. Sin capa gratuita.",
    "fuente_precio_url": "https://aws.amazon.com/lightsail/pricing/"
   },
   {
    "concepto": "Transcripción gpt-4o-mini-transcribe",
    "usd_anual": 25,
    "supuesto": "USD 0,003 por minuto x 7.000 minutos (30 usuarios x 4 minutos x 40 semanas, más pruebas), redondeado.",
    "fuente_precio_url": "https://developers.openai.com/api/docs/pricing"
   },
   {
    "concepto": "Claude Haiku 4.5",
    "usd_anual": 40,
    "supuesto": "USD 1 y 5 por millón de tokens de entrada y salida; 10.000 audios x (2.000 + 400 tokens).",
    "fuente_precio_url": "https://platform.claude.com/docs/en/about-claude/pricing"
   },
   {
    "concepto": "Dominio",
    "usd_anual": 15,
    "supuesto": "Estimación por encima de un .com por un año; Cloudflare Registrar no publica el precio en su página."
   }
  ]
 },
 "competidores": [
  {
   "nombre": "miTambo",
   "evidencia_ids": [
    "F-agro-001"
   ],
   "hueco": "El competidor más cercano: uruguaya, sin internet, unos USD 10 por mes. Solo cubre tambos; extenderla a carne es posible, así que el hueco es de foco pastoril y de voz, y es temporal."
  },
  {
   "nombre": "Cattler",
   "evidencia_ids": [
    "F-agro-006"
   ],
   "hueco": "Foco en feedlots, no en ganadería pastoril."
  },
  {
   "nombre": "Albor",
   "evidencia_ids": [
    "F-agro-007"
   ],
   "hueco": "Sistema integral paraguayo (contabilidad, sueldos), ficha de 2018. No es ancla de precio; la ficha no muestra voz ni uso sin señal."
  }
 ],
 "monetizacion": "El productor paga entre USD 6 y 10 por mes por establecimiento (ancla local: miTambo, unos USD 10 con prueba gratis, F-agro-001), con prueba gratis; veterinarios, USD 35 por mes hasta 15 clientes. Canal supuesto: veterinarios, gremiales y ferias, sin ficha que lo respalde. Escenario ilustrativo: 300 establecimientos a USD 60 por año = USD 18.000 por año al tercer año. Todos los precios y el escenario son supuestos a validar en entrevistas y piloto.",
 "riesgos": [
  "Errores al transcribir jerga rural y números de caravana.",
  "Baja disposición a pagar del productor chico y costo actual sin medir.",
  "El MGAP puede ampliar sus herramientas digitales (F-agro-004) y cubrir parte del trámite.",
  "miTambo puede extenderse a ganadería de carne, y la voz con LLM es copiable.",
  "Sin contacto identificado, el piloto y los audios reales pueden no conseguirse.",
  "Ley 18.331: consentimiento, transferencia internacional a proveedores de IA y registro de la base."
 ],
 "supuestos": [
  "Los productores chicos registran en papel o WhatsApp y notifican al SNIG a mano o con intermediarios; el costo en horas y errores no está medido y se mide en entrevistas.",
  "El precio de Albor no es referencia; USD 6 a 10 por mes es aceptable según el único ancla local (miTambo); sin validar.",
  "Los veterinarios llevan la trazabilidad de varios clientes y pagarían por cartera; sin ficha.",
  "No se sabe si el SNIG tiene API para terceros (la página oficial abierta no lo dice); el MVP no la necesita y exporta datos para cargar a mano. A confirmar con el MGAP.",
  "La señal en el campo es intermitente; sin ficha, se confirma en entrevistas.",
  "No hay contacto identificado; se buscan productores y veterinarios vía gremiales y ferias antes de diciembre de 2026. Si no se consiguen, el piloto baja a pruebas con guiones.",
  "Privacidad: consentimiento escrito de productor y peón; audio borrado tras confirmar el evento; al LLM solo va texto sin nombres; transferencia internacional a revisar contra la Ley 18.331.",
  "Fichas de competidores de 2018 a 2023; su oferta pudo cambiar."
 ],
 "evidencias": [
  "F-agro-002",
  "F-agro-004",
  "F-agro-007",
  "F-agro-001",
  "F-agro-006"
 ]
}
