{
 "id": "i002",
 "titulo": "Seguimiento de pacientes tras un intento de autoeliminación para equipos de salud mental",
 "problema": "En 2025 el MSP registró 668 suicidios y 6.140 intentos de 5.144 personas: casi mil intentos fueron de personas que ya habían intentado ese mismo año (F-salud-009). La continuidad entre instituciones es limitada: la historia clínica interoperable cubre 14 de 43 prestadores integrales y deja fuera a más de 100 organizaciones potenciales (F-salud-004), y el MSP reconoce falta de sistemas de información para seguir plazos asistenciales (F-salud-002). El paciente que no vuelve al control se pierde sin que nadie lo note.",
 "usuario": "Equipos de salud mental de prestadores chicos, policlínicas del interior y organizaciones que hoy siguen casos con planillas. Paga la institución; lo usan psicólogos, psiquiatras y referentes de seguimiento.",
 "solucion": "Una herramienta de gestión de casos: al ingresar un paciente tras un intento se crea un plan de contactos con fechas (por ejemplo, a los 7, 30 y 90 días), el sistema asigna responsable, avisa al equipo cuando un contacto vence sin registrarse y manda al paciente, con su consentimiento, un recordatorio de consulta por WhatsApp. Permite derivar el caso a otra institución con un resumen exportable. No calcula riesgo ni diagnostica: organiza el seguimiento que el equipo ya decide.",
 "mvp": {
  "semestre_1": [
   "Registro de casos con consentimiento, roles y bitácora de auditoría",
   "Planes de contacto configurables con vencimientos y tablero del equipo",
   "Demo al tutor con casos ficticios"
  ],
  "semestre_2": [
   "Alertas de contactos vencidos y recordatorios al paciente por WhatsApp",
   "Derivación con resumen exportable y cifrado de datos sensibles",
   "Piloto con un equipo de salud mental y entrevistas de validación",
   "Business case y plan de cumplimiento de la Ley 18.331"
  ]
 },
 "stack": [
  "Python FastAPI",
  "PostgreSQL con cifrado de columnas",
  "React",
  "WhatsApp Business Platform (Cloud API)",
  "Docker",
  "AWS Lightsail"
 ],
 "costo_infra": {
  "total_anual_usd": 139,
  "items": [
   {
    "concepto": "Servidor AWS Lightsail Linux 1 GB con IPv4",
    "usd_anual": 84,
    "supuesto": "Un servidor 12 meses a USD 7 por mes; sin contar capa gratuita porque la página no dice cuánto dura.",
    "fuente_precio_url": "https://aws.amazon.com/lightsail/pricing/"
   },
   {
    "concepto": "Mensajes plantilla de WhatsApp",
    "usd_anual": 40,
    "supuesto": "Estimación por encima: Meta cobra por plantilla entregada pero la página no muestra la tarifa; supongo USD 0,03 por mensaje y unos 1.300 mensajes (40 pacientes, 4 al mes, 6 meses, más pruebas)."
   },
   {
    "concepto": "Dominio propio",
    "usd_anual": 15,
    "supuesto": "Estimación por encima sin fuente abierta: un dominio .com por un año, redondeado hacia arriba con margen."
   }
  ]
 },
 "competidores": [],
 "monetizacion": "Suscripción mensual por equipo institucional, de USD 100 a 200 según cantidad de casos activos. Canal: venta directa a direcciones técnicas de prestadores chicos y a organizaciones de salud mental.",
 "riesgos": [
  "Datos de salud mental muy sensibles: un incidente de seguridad sería grave",
  "Sin socio identificado para el piloto; conseguir un equipo dispuesto puede llevar tiempo",
  "Que la institución lo vea como dispositivo médico si se le pide puntuar riesgo, cosa que el MVP evita",
  "Presupuestos acotados de los prestadores chicos"
 ],
 "supuestos": [
  "Las fichas no muestran competidores de seguimiento post intento; no afirmo que no existan",
  "Los equipos de salud mental de prestadores chicos siguen hoy estos casos con planillas o papel",
  "Un seguimiento con fechas fijas es práctica aceptada por los equipos",
  "Una institución paga USD 100 a 200 al mes por esta herramienta",
  "Una herramienta que no diagnostica ni puntúa riesgo no requiere habilitación como dispositivo médico",
  "La tarifa de plantillas de WhatsApp para Uruguay no supera USD 0,03"
 ],
 "evidencias": [
  "F-salud-009",
  "F-salud-004",
  "F-salud-002"
 ]
}
