{
 "id": "i006",
 "titulo": "Chequeo de zonas sensibles y reporte de cobertura para aplicadores con drones",
 "problema": "Los drones aplicadores crecen en Uruguay: 30 vendidos en 2022 y 30 solo en el primer trimestre de 2023, a USD 35.000 a 45.000 cada uno, con datos de vuelo y aplicación por gestionar (F-agro-008). Quien aplica con drones debe respetar zonas buffer y registrar cada aplicación en el RAPF (F-defensa-r1-m02-i006-001, F-defensa-r1-m02-i006-003); la aplicación aérea no puede ser a menos de 500 m de un centro educativo (F-defensa-r1-m02-i006-002). El operador chico carga esa obligación sin herramienta propia.",
 "usuario": "Contratistas y productores que aplican con 1 a 3 drones. Paga el operador; su cliente recibe el reporte gratis.",
 "solucion": "Web y PWA para el operador. Antes de volar: importa el lote y PostGIS chequea la distancia a escuelas y centros poblados con capas abiertas. Después: importa el registro de vuelo (KML o traza manual), reconstruye franjas con el ancho declarado y calcula hectáreas cubiertas, solapes, faltantes e invasiones. Un LLM con visión precarga producto y dosis desde la etiqueta. Sale un reporte PDF.",
 "mvp": {
  "semestre_1": [
   "Relevar capas abiertas y distancias; chequeo en PostGIS",
   "Mapa web con lotes KML e importador KML, con carga manual como plan B",
   "Entrevistas a 3 a 5 operadores: marca, formato y pago",
   "Demo: planificar junto a una escuela y ver la advertencia"
  ],
  "semestre_2": [
   "Reconstrucción de franjas: cobertura, solapes, faltantes e invasiones",
   "Precarga de producto y dosis desde foto con LLM",
   "Reporte PDF e historial por lote",
   "Demo con registros reales o simulados; piloto de 2 a 4 operadores si hay temporada"
  ]
 },
 "stack": [
  "React + Vite (PWA)",
  "Mapbox GL JS",
  "Python FastAPI",
  "PostgreSQL + PostGIS",
  "Shapely",
  "Claude Haiku 4.5 (visión)",
  "WeasyPrint",
  "Docker Compose",
  "AWS Lightsail"
 ],
 "costo_infra": {
  "total_anual_usd": 174,
  "items": [
   {
    "concepto": "AWS Lightsail Linux 2 GB, IPv4",
    "usd_anual": 144,
    "supuesto": "USD 12 por mes x 12; API, PostGIS y geoprocesamiento en Docker. Sin capa gratuita.",
    "fuente_precio_url": "https://aws.amazon.com/lightsail/pricing/"
   },
   {
    "concepto": "Claude Haiku 4.5",
    "usd_anual": 15,
    "supuesto": "USD 1 y 5 por millón de tokens de entrada y salida; 3.000 fotos x (2.000 + 300 tokens), redondeado.",
    "fuente_precio_url": "https://platform.claude.com/docs/en/about-claude/pricing"
   },
   {
    "concepto": "Mapbox GL JS",
    "usd_anual": 0,
    "supuesto": "Capa gratuita de 50.000 cargas por mes, renovada mensualmente sin vencimiento indicado; el piloto usa menos de 3.000.",
    "fuente_precio_url": "https://www.mapbox.com/pricing"
   },
   {
    "concepto": "Dominio",
    "usd_anual": 15,
    "supuesto": "Estimación por encima de un .com por un año; Cloudflare Registrar no publica el precio en su página."
   }
  ]
 },
 "competidores": [
  {
   "nombre": "Sistema GMA (MGAP)",
   "evidencia_ids": [
    "F-agro-005"
   ],
   "hueco": "Alerta al Estado, no ayuda al operador a planificar ni reportar."
  },
  {
   "nombre": "App del fabricante (DJI), AirData y AcreConnect",
   "evidencia_ids": [
    "F-defensa-r1-m02-i006-004",
    "F-defensa-r1-m02-i006-005"
   ],
   "hueco": "Manejan registros KML; ninguna ficha muestra chequeo de zonas uruguayas ni reporte para el RAPF. Su oferta local no está verificada."
  }
 ],
 "monetizacion": "El operador paga USD 250 por año por drone; su cliente no paga. Canal: distribuidores de drones y contacto directo. Escenario: 40 drones al tercer año = USD 10.000 por año, fracción alta de un parque desconocido (60 vendidos hasta 2023, F-agro-008); crecer exige Argentina o Brasil. Precio a validar.",
 "riesgos": [
  "Formatos de vuelo cerrados o distintos según la marca.",
  "El KML no trae telemetría detallada: la precisión depende del GPS y del ancho declarado.",
  "Mercado chico; los fabricantes pueden copiar la función.",
  "Un falso negativo perjudica: el producto advierte, no habilita."
 ],
 "supuestos": [
  "El cliente exige el reporte y el operador paga USD 250 por año.",
  "Los operadores chicos no tienen hoy chequeo ni reporte automático.",
  "La marca dominante se desconoce; el KML de DJI está documentado.",
  "Hay capas abiertas utilizables; los 500 m rigen para drones; la distancia a centros poblados es a relevar.",
  "Se llega a operadores antes de diciembre de 2026, sin contacto identificado.",
  "El MVP usa polígonos sin titular (Ley 18.331).",
  "Datos de 2019 y 2023."
 ],
 "evidencias": [
  "F-agro-008",
  "F-agro-005",
  "F-defensa-r1-m02-i006-001",
  "F-defensa-r1-m02-i006-002",
  "F-defensa-r1-m02-i006-003",
  "F-defensa-r1-m02-i006-004",
  "F-defensa-r1-m02-i006-005"
 ]
}
